[
  {
    "id": "hand_basic_001",
    "name": "出刀",
    "cardType": "手牌",
    "handType": "基础",
    "tags": ["攻击"],
    "timing": "出牌阶段",
    "effectText": "指定对方本体为目标。对方可以打出【闪避】响应。若对方没有打出【闪避】，其本体受到 1 点伤害。",
    "cards": [
      { "suit": "黑桃", "rank": "3" },
      { "suit": "黑桃", "rank": "4" },
      { "suit": "黑桃", "rank": "5" },
      { "suit": "黑桃", "rank": "6" },
      { "suit": "黑桃", "rank": "7" },
      { "suit": "黑桃", "rank": "8" },
      { "suit": "黑桃", "rank": "9" },
      { "suit": "黑桃", "rank": "10" },
      { "suit": "黑桃", "rank": "J" },
      { "suit": "黑桃", "rank": "K" },
      { "suit": "方块", "rank": "A" },
      { "suit": "红桃", "rank": "5" },
      { "suit": "红桃", "rank": "8" },
      { "suit": "红桃", "rank": "10" },
      { "suit": "红桃", "rank": "J" },
      { "suit": "方块", "rank": "J" }
    ]
  },
  {
    "id": "hand_basic_002",
    "name": "闪避",
    "cardType": "手牌",
    "handType": "基础",
    "tags": ["防御"],
    "timing": "当你的本体成为【出刀】的目标时",
    "effectText": "抵消此次【出刀】。",
    "cards": [
      { "suit": "红桃", "rank": "2" },
      { "suit": "红桃", "rank": "4" },
      { "suit": "红桃", "rank": "6" },
      { "suit": "黑桃", "rank": "A" },
      { "suit": "梅花", "rank": "2" },
      { "suit": "方块", "rank": "5" },
      { "suit": "方块", "rank": "7" },
      { "suit": "方块", "rank": "9" }
    ]
  },
  {
    "id": "hand_basic_003",
    "name": "急救",
    "cardType": "手牌",
    "handType": "基础",
    "tags": ["回复"],
    "timing": "出牌阶段或处于濒死时",
    "effectText": "回复自己本体 1 点体力，不能超过体力上限。",
    "cards": [
      { "suit": "红桃", "rank": "A" },
      { "suit": "红桃", "rank": "3" },
      { "suit": "方块", "rank": "2" },
      { "suit": "方块", "rank": "4" }
    ]
  },
  {
    "id": "hand_basic_004",
    "name": "冒名顶替",
    "cardType": "手牌",
    "handType": "基础",
    "tags": ["转化"],
    "timing": "当你需要使用或打出基础牌时",
    "effectText": "你可以将此牌当【出刀】、【闪避】或【急救】使用或打出。",
    "cards": [
      { "joker": "small" }
    ]
  },
  {
    "id": "hand_trick_001",
    "name": "摸鱼",
    "cardType": "手牌",
    "handType": "行动",
    "tags": ["资源"],
    "timing": "出牌阶段",
    "effectText": "摸 2 张手牌。",
    "cards": [
      { "suit": "黑桃", "rank": "Q" },
      { "suit": "梅花", "rank": "A" }
    ]
  },
  {
    "id": "hand_trick_002",
    "name": "搞破坏",
    "cardType": "手牌",
    "handType": "行动",
    "tags": ["控制"],
    "timing": "出牌阶段",
    "effectText": "弃置对手 1 张手牌。",
    "cards": [
      { "suit": "黑桃", "rank": "2" },
      { "suit": "梅花", "rank": "3" },
      { "suit": "梅花", "rank": "4" },
      { "suit": "梅花", "rank": "5" }
    ]
  },
  {
    "id": "hand_trick_003",
    "name": "顺手牵鹅",
    "cardType": "手牌",
    "handType": "行动",
    "tags": ["资源"],
    "timing": "出牌阶段",
    "effectText": "获得对手 1 张手牌。",
    "cards": [
      { "suit": "梅花", "rank": "6" },
      { "suit": "梅花", "rank": "7" }
    ]
  },
  {
    "id": "hand_trick_004",
    "name": "危机破坏",
    "cardType": "手牌",
    "handType": "行动",
    "tags": ["控制"],
    "timing": "出牌阶段",
    "effectText": "选择对手 1 张未休整的明置角色。对手选择一项：休整该角色；或其本体受到 1 点伤害。",
    "cards": [
      { "suit": "梅花", "rank": "8" },
      { "suit": "红桃", "rank": "Q" },
      { "suit": "红桃", "rank": "K" }
    ]
  },
  {
    "id": "hand_trick_005",
    "name": "鼓舞",
    "cardType": "手牌",
    "handType": "行动",
    "tags": ["强化"],
    "timing": "出牌阶段",
    "effectText": "本回合你下一次发动角色技能时，若技能费用不为退场，则修改为休整 1。",
    "cards": [
      { "suit": "梅花", "rank": "9" },
      { "suit": "梅花", "rank": "10" },
      { "suit": "方块", "rank": "Q" }
    ]
  },
  {
    "id": "hand_trick_006",
    "name": "临时布阵",
    "cardType": "手牌",
    "handType": "行动",
    "tags": ["布阵"],
    "timing": "出牌阶段",
    "effectText": "若你的角色区未满，从你的角色牌堆中暗置上阵 1 张角色。",
    "cards": [
      { "suit": "梅花", "rank": "J" },
      { "suit": "梅花", "rank": "Q" },
      { "suit": "红桃", "rank": "7" }
    ]
  },
  {
    "id": "hand_trick_007",
    "name": "看破",
    "cardType": "手牌",
    "handType": "行动",
    "tags": ["情报"],
    "timing": "出牌阶段",
    "effectText": "查看对手 1 张暗置角色。你可以选择令其明置。",
    "cards": [
      { "suit": "方块", "rank": "3" },
      { "suit": "方块", "rank": "6" },
      { "suit": "梅花", "rank": "K" }
    ]
  },
  {
    "id": "hand_trick_008",
    "name": "撤回",
    "cardType": "手牌",
    "handType": "行动",
    "tags": ["回收"],
    "timing": "当你使用的【出刀】或行动牌被响应后",
    "effectText": "将该牌从手牌弃牌区加入手牌。本次使用不计入你本回合使用该牌的次数限制。",
    "cards": [
      { "suit": "方块", "rank": "10" },
      { "suit": "方块", "rank": "K" }
    ]
  },
  {
    "id": "hand_trick_009",
    "name": "别急",
    "cardType": "手牌",
    "handType": "行动",
    "tags": ["反制"],
    "timing": "当任一玩家使用行动牌时",
    "effectText": "抵消该行动牌的效果。",
    "cards": [
      { "suit": "红桃", "rank": "9" },
      { "suit": "方块", "rank": "8" }
    ]
  },
  {
    "id": "hand_trick_010",
    "name": "紧急会议",
    "cardType": "手牌",
    "handType": "行动",
    "tags": ["响应"],
    "timing": "当对手于出牌阶段使用【出刀】或行动牌时",
    "effectText": "抵消该牌的效果并结束此出牌阶段。然后双方各从自己的角色牌堆顶暗置上阵角色，直至各自角色区没有空位或角色牌堆为空。",
    "cards": [
      { "joker": "big" }
    ]
  }
]
